{
  "$schema": "./Set-CISL1Hardening.manifest.schema.json",
  "name": "CISL1Hardening",
  "version": "2.1.0",
  "baseline": "CIS Microsoft Windows 11 Enterprise Benchmark v5.0.0 L1",
  "lastModifiedUtc": "2026-05-30T00:00:00Z",
  "description": "Switch-style manifest for CIS L1 controls. Set 'enabled' to false on any entry to skip the control while preserving its presence in the audit trail (recorded as SKIPPED_BY_MANIFEST). Registry-only controls live in 'registrySettings'; service disablements live in 'services'; reminders for items that must be applied via GPO / Intune live in 'notes'.",

  "registrySettings": [
    { "section": "2.3.1 Accounts",            "cisRef": "2.3.1.1",   "description": "Block Microsoft accounts",                  "path": "HKLM:\\SOFTWARE\\Microsoft\\Windows\\CurrentVersion\\Policies\\System",                                  "name": "NoConnectedUser",            "type": "DWord", "value": 3,         "enabled": false },
    { "section": "2.3.2 Audit",               "cisRef": "2.3.2.1",   "description": "Force audit subcategory settings",          "path": "HKLM:\\SYSTEM\\CurrentControlSet\\Control\\Lsa",                                                          "name": "SCENoApplyLegacyAuditPolicy","type": "DWord", "value": 1,         "enabled": true },

    { "section": "2.3.7 Interactive logon",   "cisRef": "2.3.7.1",   "description": "Do not display last user",                  "path": "HKLM:\\SOFTWARE\\Microsoft\\Windows\\CurrentVersion\\Policies\\System",                                  "name": "DontDisplayLastUserName",    "type": "DWord", "value": 1,         "enabled": true },
    { "section": "2.3.7 Interactive logon",   "cisRef": "2.3.7.2",   "description": "Require CTRL+ALT+DEL",                      "path": "HKLM:\\SOFTWARE\\Microsoft\\Windows\\CurrentVersion\\Policies\\System",                                  "name": "DisableCAD",                 "type": "DWord", "value": 0,         "enabled": true },
    { "section": "2.3.7 Interactive logon",   "cisRef": "2.3.7.3",   "description": "Inactivity timeout: 900s",                  "path": "HKLM:\\SOFTWARE\\Microsoft\\Windows\\CurrentVersion\\Policies\\System",                                  "name": "InactivityTimeoutSecs",      "type": "DWord", "value": 900,       "enabled": true },

    { "section": "2.3.8 SMB Client",          "cisRef": "2.3.8.1",   "description": "SMB client: Require signing",               "path": "HKLM:\\SYSTEM\\CurrentControlSet\\Services\\LanmanWorkstation\\Parameters",                              "name": "RequireSecuritySignature",   "type": "DWord", "value": 1,         "enabled": true },
    { "section": "2.3.8 SMB Client",          "cisRef": "2.3.8.2",   "description": "SMB client: Enable signing",                "path": "HKLM:\\SYSTEM\\CurrentControlSet\\Services\\LanmanWorkstation\\Parameters",                              "name": "EnableSecuritySignature",    "type": "DWord", "value": 1,         "enabled": true },
    { "section": "2.3.8 SMB Client",          "cisRef": "2.3.8.3",   "description": "SMB client: No plaintext password",         "path": "HKLM:\\SYSTEM\\CurrentControlSet\\Services\\LanmanWorkstation\\Parameters",                              "name": "EnablePlainTextPassword",    "type": "DWord", "value": 0,         "enabled": true },

    { "section": "2.3.9 SMB Server",          "cisRef": "2.3.9.1",   "description": "SMB server: Require signing",               "path": "HKLM:\\SYSTEM\\CurrentControlSet\\Services\\LanmanServer\\Parameters",                                   "name": "RequireSecuritySignature",   "type": "DWord", "value": 1,         "enabled": true },
    { "section": "2.3.9 SMB Server",          "cisRef": "2.3.9.2",   "description": "SMB server: Enable signing",                "path": "HKLM:\\SYSTEM\\CurrentControlSet\\Services\\LanmanServer\\Parameters",                                   "name": "EnableSecuritySignature",    "type": "DWord", "value": 1,         "enabled": true },
    { "section": "2.3.9 SMB Server",          "cisRef": "2.3.9.3",   "description": "Disconnect on logon hours expire",          "path": "HKLM:\\SYSTEM\\CurrentControlSet\\Services\\LanmanServer\\Parameters",                                   "name": "EnableForcedLogOff",         "type": "DWord", "value": 1,         "enabled": true },

    { "section": "2.3.10 Network access",     "cisRef": "2.3.10.2",  "description": "Restrict anon SAM enum",                    "path": "HKLM:\\SYSTEM\\CurrentControlSet\\Control\\Lsa",                                                          "name": "RestrictAnonymousSAM",       "type": "DWord", "value": 1,         "enabled": true },
    { "section": "2.3.10 Network access",     "cisRef": "2.3.10.3",  "description": "Restrict anon SAM+share",                   "path": "HKLM:\\SYSTEM\\CurrentControlSet\\Control\\Lsa",                                                          "name": "RestrictAnonymous",          "type": "DWord", "value": 1,         "enabled": true },
    { "section": "2.3.10 Network access",     "cisRef": "2.3.10.5",  "description": "Everyone != anonymous",                     "path": "HKLM:\\SYSTEM\\CurrentControlSet\\Control\\Lsa",                                                          "name": "EveryoneIncludesAnonymous",  "type": "DWord", "value": 0,         "enabled": true },
    { "section": "2.3.10 Network access",     "cisRef": "2.3.10.7",  "description": "Restrict anonymous pipe/share",             "path": "HKLM:\\SYSTEM\\CurrentControlSet\\Services\\LanmanServer\\Parameters",                                   "name": "RestrictNullSessAccess",     "type": "DWord", "value": 1,         "enabled": true },
    { "section": "2.3.10 Network access",     "cisRef": "2.3.10.11", "description": "Clear anonymous shares",                    "path": "HKLM:\\SYSTEM\\CurrentControlSet\\Services\\LanmanServer\\Parameters",                                   "name": "NullSessionShares",          "type": "MultiString", "value": [""], "enabled": true },

    { "section": "2.3.11 Network security",   "cisRef": "2.3.11.1",  "description": "Disable NULL session fallback",             "path": "HKLM:\\SYSTEM\\CurrentControlSet\\Control\\Lsa\\MSV1_0",                                                  "name": "AllowNullSessionFallback",   "type": "DWord", "value": 0,         "enabled": true },
    { "section": "2.3.11 Network security",   "cisRef": "2.3.11.2",  "description": "Computer identity for NTLM",                "path": "HKLM:\\SYSTEM\\CurrentControlSet\\Control\\Lsa",                                                          "name": "UseMachineId",               "type": "DWord", "value": 1,         "enabled": true },
    { "section": "2.3.11 Network security",   "cisRef": "2.3.11.3",  "description": "Disable PKU2U",                             "path": "HKLM:\\SYSTEM\\CurrentControlSet\\Control\\Lsa\\pku2u",                                                   "name": "AllowOnlineID",              "type": "DWord", "value": 0,         "enabled": true },
    { "section": "2.3.11 Network security",   "cisRef": "2.3.11.4",  "description": "Kerberos: AES only (no DES/RC4)",           "path": "HKLM:\\SOFTWARE\\Microsoft\\Windows\\CurrentVersion\\Policies\\System\\Kerberos\\Parameters",            "name": "SupportedEncryptionTypes",   "type": "DWord", "value": 2147483640,"enabled": true },
    { "section": "2.3.11 Network security",   "cisRef": "2.3.11.5",  "description": "NTLMv2 only; refuse LM/NTLM",               "path": "HKLM:\\SYSTEM\\CurrentControlSet\\Control\\Lsa",                                                          "name": "LmCompatibilityLevel",       "type": "DWord", "value": 5,         "enabled": true },
    { "section": "2.3.11 Network security",   "cisRef": "2.3.11.6",  "description": "LDAP: Require signing",                     "path": "HKLM:\\SYSTEM\\CurrentControlSet\\Services\\LDAP",                                                        "name": "LDAPClientIntegrity",        "type": "DWord", "value": 2,         "enabled": true },
    { "section": "2.3.11 Network security",   "cisRef": "2.3.11.7",  "description": "NTLM client: NTLMv2+128-bit",               "path": "HKLM:\\SYSTEM\\CurrentControlSet\\Control\\Lsa\\MSV1_0",                                                  "name": "NTLMMinClientSec",           "type": "DWord", "value": 537395200, "enabled": true },
    { "section": "2.3.11 Network security",   "cisRef": "2.3.11.8",  "description": "NTLM server: NTLMv2+128-bit",               "path": "HKLM:\\SYSTEM\\CurrentControlSet\\Control\\Lsa\\MSV1_0",                                                  "name": "NTLMMinServerSec",           "type": "DWord", "value": 537395200, "enabled": true },

    { "section": "2.3.14 System cryptography","cisRef": "2.3.14.1",  "description": "Force strong key protection",               "path": "HKLM:\\SOFTWARE\\Policies\\Microsoft\\Cryptography",                                                     "name": "ForceKeyProtection",         "type": "DWord", "value": 2,         "enabled": false },

    { "section": "2.3.17 UAC",                "cisRef": "2.3.17.1",  "description": "UAC: Admin Approval for built-in",          "path": "HKLM:\\SOFTWARE\\Microsoft\\Windows\\CurrentVersion\\Policies\\System",                                  "name": "FilterAdministratorToken",   "type": "DWord", "value": 1,         "enabled": true },
    { "section": "2.3.17 UAC",                "cisRef": "2.3.17.2",  "description": "UAC: Prompt consent secure desktop",        "path": "HKLM:\\SOFTWARE\\Microsoft\\Windows\\CurrentVersion\\Policies\\System",                                  "name": "ConsentPromptBehaviorAdmin", "type": "DWord", "value": 2,         "enabled": true },